{
  "schema": "showcase-manifest/1",
  "showcase_mode": true,
  "live_enabled": false,
  "featured_bundle": "fx-golden",
  "bundles": [
    {
      "id": "fx-golden",
      "title": "Fixture: P1 head-to-head and M4 audits (golden)",
      "status": "verified",
      "created_at": "2026-10-01T06:00:00Z",
      "featured": true
    },
    {
      "id": "fx-negatives",
      "title": "Fixture: negative results (frontier wins ℓ ≤ 3, a DORMANT loop, FGR above bound)",
      "status": "verified",
      "created_at": "2026-10-01T05:00:00Z",
      "featured": false
    },
    {
      "id": "fx-p1-only",
      "title": "Fixture: P1 only, no audits yet",
      "status": "verified",
      "created_at": "2026-09-30T12:00:00Z",
      "featured": false
    },
    {
      "id": "fx-poison-simulated",
      "title": "Poisoned fixture: simulated data",
      "status": "verified",
      "created_at": "2026-09-29T00:04:00Z",
      "featured": false
    },
    {
      "id": "fx-poison-fixture-kind",
      "title": "Poisoned fixture: fixture kind (refused by production rules)",
      "status": "verified",
      "created_at": "2026-09-29T00:03:00Z",
      "featured": false
    },
    {
      "id": "fx-poison-no-run-ids",
      "title": "Poisoned fixture: no run ids",
      "status": "verified",
      "created_at": "2026-09-29T00:02:00Z",
      "featured": false
    },
    {
      "id": "fx-poison-tampered",
      "title": "Poisoned fixture: a view edited after SHA256SUMS",
      "status": "verified",
      "created_at": "2026-09-29T00:01:00Z",
      "featured": false
    }
  ],
  "harness_commit": "0000000fixture"
}
